{
  "reconciliation_id": "recon-1",
  "status": "completed",
  "capability_snapshot": {
    "snapshot_id": "snapshot-1",
    "created_at": "2026-04-27T15:00:00Z",
    "capabilities_hash": "aaaaaaaaaaaaaaaaaaaaaaaaaaaaaaaaaaaaaaaaaaaaaaaaaaaaaaaaaaaaaaaa",
    "capabilities": [
      {
        "endpoint_id": "repo-status",
        "capability_name": "status",
        "description": "Read repository status.",
        "input_schema": {
          "type": "object"
        },
        "risk_level": "read",
        "requires_approval": false,
        "capability_digest": "aaaaaaaaaaaaaaaaaaaaaaaaaaaaaaaaaaaaaaaaaaaaaaaaaaaaaaaaaaaaaaaa"
      }
    ]
  },
  "artifact": {
    "artifact_id": "artifact-1",
    "schema_version": "open-cot.core.v1",
    "capability_snapshot_id": "snapshot-1",
    "intent_verification": {
      "objective": "Summarize repository status.",
      "request_boundaries": [
        "read-only"
      ],
      "allowed_scope": [
        "inspect files"
      ],
      "prohibited_scope": [
        "write files"
      ]
    },
    "reasoning_trace": {
      "evidence_mode": "audit_summary",
      "summary": "The request is read-only and can use the repository status endpoint.",
      "steps": [
        {
          "step_id": "r1",
          "kind": "interpretation",
          "content": "Classified as read-only inspection.",
          "visibility": "audit_summary",
          "confidence": 0.9
        }
      ]
    },
    "assumptions": [
      "Repository access is available."
    ],
    "execution_intents": [],
    "observations": [],
    "uncertainty": {
      "level": "low",
      "explanation": "The requested operation is narrow."
    }
  },
  "executed_intents": [
    {
      "intent_id": "intent-1",
      "snapshot_id": "snapshot-1",
      "endpoint_id": "repo-status",
      "capability_name": "status",
      "capability_digest": "aaaaaaaaaaaaaaaaaaaaaaaaaaaaaaaaaaaaaaaaaaaaaaaaaaaaaaaaaaaaaaaa",
      "risk_level": "read",
      "requires_approval": false,
      "idempotency_key": "idem-1",
      "arguments": {}
    }
  ],
  "skipped_intents": [],
  "observations": [
    {
      "observation_id": "obs-1",
      "intent_id": "intent-1",
      "status": "recorded",
      "summary": "Repository status was read.",
      "output": {
        "clean": true
      },
      "observed_at": "2026-04-27T15:00:00Z"
    }
  ],
  "errors": [],
  "final_message": "Completed read-only inspection."
}
